<?xml version="1.0" encoding="utf-8"?>
<xs:schema xmlns="http://www.uniovi.es/alumnos" 
	elementFormDefault="qualified" 
	targetNamespace="http://www.uniovi.es/alumnos" 
	xmlns:xs="http://www.w3.org/2001/XMLSchema">
	
	<xs:element name="usuarios">
		<xs:complexType>
			<xs:sequence>
                <!-- Puede haber infinitos usuarios -->
				<xs:element minOccurs="0" maxOccurs="unbounded" ref="usuario" />
			</xs:sequence>
		</xs:complexType>
	</xs:element>
	<xs:element name="usuario">
		<xs:complexType>
			<xs:sequence>
                <!-- Cada usuario puede tener un grupo de datos y un grupo de amigos, pero no obligatoriamiente -->
				<xs:element minOccurs="0" maxOccurs="1" ref="datos" />
				<xs:element minOccurs="0" maxOccurs="1" ref="amigos" />
			</xs:sequence>
            <!-- La id es un numero obligatorio -->
			<xs:attribute name="id" type="xs:int" use="required" />
            <!-- El nickname es un string obligatorio -->
			<xs:attribute name="nickname" type="xs:string" use="required" />
		</xs:complexType>
	</xs:element>
	<xs:element name="datos">
		<xs:complexType>
			<xs:sequence>
				<xs:element ref="fechaNacimiento" />
				<xs:element ref="estado" />
				<xs:element minOccurs="0" maxOccurs="1" ref="fotoPerfil" />
			</xs:sequence>
		</xs:complexType>
	</xs:element>
	<xs:element name="fechaNacimiento">
		<xs:complexType>
			<xs:attribute name="dia" type="diaTipo" use="required" />
			<xs:attribute name="mes" type="mesTipo" use="required" />
			<xs:attribute name="a침o" type="a침oTipo" use="required" />
		</xs:complexType>
	</xs:element>
	<xs:element name="estado">
		<xs:complexType>
			<xs:simpleContent>
				<xs:extension base="xs:string">
					<xs:attribute name="mensaje" type="xs:string" use="required" />
				</xs:extension>
			</xs:simpleContent>
		</xs:complexType>
	</xs:element>
	<xs:element name="fotoPerfil">
		<xs:complexType>
			<!-- Las fotos de perfil deben ser URLs -->
			<xs:attribute name="href" type="xs:anyURI" use="required" />
		</xs:complexType>
	</xs:element>
	<xs:element name="amigos">
		<xs:complexType>
			<xs:sequence>
                <!-- Cada usuario puede tener infinitos amigos, pero al menos uno (Si pone la etiqueta 'amigos') -->
				<xs:element minOccurs="1" maxOccurs="unbounded" ref="usuario" />
			</xs:sequence>
		</xs:complexType>
	</xs:element>

    <!-- Tipos nuevos para validaci칩n de atributos -->
        
    <xs:simpleType name ="diaTipo">
        <xs:restriction base="xs:integer">
            <xs:minInclusive value="1"/>
            <xs:maxInclusive value="31"/>
        </xs:restriction>
    </xs:simpleType>

    <xs:simpleType name ="mesTipo">
        <xs:restriction base="xs:integer">
            <xs:minInclusive value="1"/>
            <xs:maxInclusive value="12"/>
        </xs:restriction>
    </xs:simpleType>

    <xs:simpleType name ="a침oTipo">
        <xs:restriction base="xs:integer">
            <xs:minInclusive value="1900"/>
            <xs:maxInclusive value="2022"/>
        </xs:restriction>
    </xs:simpleType>
</xs:schema>